Date,Country/Location,Rating,Author,Title,Body,Image links,Image Video Links,Verified Purchase,URL,Helpful count,Variation information,Styles,
02/24/2019,United States,5,Ryan Carpus,Great features!,"I'm happily surprised with this stroller. It's pretty good quality for an umbrella stroller and has a lot of features that most don't...all at a better price than many of the others! It has cup holders for the adults, a small storage area underneath, and the seat is able to recline (not a ton, but better than nothing!) It's very easy to use. The only downside is that the wheels don't turn (obviously they spin, but only straight). Overall, great stroller at a great price.",,,TRUE,https://www.amazon.com/gp/customer-reviews/R18SWS6RNNH9K4/ref=cm_cr_arp_d_rvw_ttl?ie=UTF8&ASIN=B07P1YSC18,5,B07GGHVL64,Color: Blue,
02/23/2019,United States,2,Amazon Customer,Doesn't fit 25 pounds,"I loved it when I first tried it, but after a couple weeks I noticed the buckle was too tight on my son who is only 25 pounds. It is supposed to fit up to 45 pounds, but even all the way loosened barely clips and is uncomfortable on him. My return window ended but amazon is amazing and let me return it anyways.",,,TRUE,https://www.amazon.com/gp/customer-reviews/R31EFCX29U5FKG/ref=cm_cr_arp_d_rvw_ttl?ie=UTF8&ASIN=B07P1YSC18,17,B07GGHVL64,Color: Blue,
02/18/2019,United States,4,Sjatkins,Ok,Very portable and fold easily.,,,TRUE,https://www.amazon.com/gp/customer-reviews/R3ERSUEVYYW7VK/ref=cm_cr_arp_d_rvw_ttl?ie=UTF8&ASIN=B07P1YSC18,0,B07GGHVL64,Color: Blue,
02/15/2019,United States,5,Abigail juares,Amazing,Perfect for my 2 year old son,,,TRUE,https://www.amazon.com/gp/customer-reviews/R3IIBLL0RMWUPW/ref=cm_cr_arp_d_rvw_ttl?ie=UTF8&ASIN=B07P1YSC18,1,B07GGHVL64,Color: Blue,
02/11/2019,United States,4,Zoey03,Space saver,"Love that it folds like an umbrella, there’s so much space in my car now. Super light and easy to unfold and fold. The only downside of this stroller is the cover on top for some reason everytime i unfold it it comes of the hinges, which at times can be frustrating. Also it worth noting that the bottom storage is not as big as i thought, i thought that maybe i can fit a diaper bag in there but nope you can't fit it. So maybe that something to keep in mind.",,,TRUE,https://www.amazon.com/gp/customer-reviews/R1L3UUIW3HA6VM/ref=cm_cr_arp_d_rvw_ttl?ie=UTF8&ASIN=B07P1YSC18,42,B07GGHVL64,Color: Blue,
02/10/2019,United States,4,Jennifer S.,good stroller,I just received it. It seems like it will be good. Have not had a chance to try it yet as we are in the middle of winter.,,,TRUE,https://www.amazon.com/gp/customer-reviews/RO7CN3XQ4AEK8/ref=cm_cr_arp_d_rvw_ttl?ie=UTF8&ASIN=B07P1YSC18,0,B07GGHVL64,Color: Blue,
02/09/2019,United States,5,linda provost,Granddaughter and great granddaughter loves it,Love it,,,TRUE,https://www.amazon.com/gp/customer-reviews/R2R44OH0POL63X/ref=cm_cr_arp_d_rvw_ttl?ie=UTF8&ASIN=B07P1YSC18,0,B07GGHVL64,Color: Blue,
02/04/2019,United States,3,Reji Nair,The rare wheels,"The rare wheels have and issue. It looks like it is not well aligned.Have to talk to the manufacturer if they will send a replacement. If we do get it, will keep it. Else will have to return the product. I dont think it is an amazon issue. The product also looks great.But will update the review depending on the customer service.",,,TRUE,https://www.amazon.com/gp/customer-reviews/R2GDQABZUL7MM6/ref=cm_cr_arp_d_rvw_ttl?ie=UTF8&ASIN=B07P1YSC18,4,B07GGHVL64,Color: Blue,
02/01/2019,United States,5,K. Moore,Great Product,The recipient is quite pleased with this stroller.,,,TRUE,https://www.amazon.com/gp/customer-reviews/ROTMBW8JHNKZA/ref=cm_cr_arp_d_rvw_ttl?ie=UTF8&ASIN=B07P1YSC18,0,B07GGHVL64,Color: Blue,
01/22/2019,United States,3,Shawnette,Terrible!,The wheels on this stroller are very much unreliable I would not recommend this stroller walking any where outside of waxed wooden floors 🤦,,,TRUE,https://www.amazon.com/gp/customer-reviews/R1A0IA4MPZ589H/ref=cm_cr_arp_d_rvw_ttl?ie=UTF8&ASIN=B07P1YSC18,0,B07GGHVL64,Color: Blue,
01/18/2019,United States,5,Orlando,Perfect,Perfect,,,TRUE,https://www.amazon.com/gp/customer-reviews/R2F0XQ3CMNJ370/ref=cm_cr_arp_d_rvw_ttl?ie=UTF8&ASIN=B07P1YSC18,0,B07GGHVL64,Color: Blue,
01/18/2019,United States,5,SACPHX,Great little stroller!,"I got this as a backup to my main stroller. This is a great little stroller for the money. The quality is higher than I expected, although the wheels will probably not last too long. It even has a dual cup holder and the sun screen works great.",,,TRUE,https://www.amazon.com/gp/customer-reviews/R3H9G2LNMHWIH6/ref=cm_cr_arp_d_rvw_ttl?ie=UTF8&ASIN=B07P1YSC18,0,B07GGHVL64,Color: Blue,
01/14/2019,United States,5,Joanna waters,Great stroller,Works great,,,TRUE,https://www.amazon.com/gp/customer-reviews/R21ULK7GMAGT/ref=cm_cr_arp_d_rvw_ttl?ie=UTF8&ASIN=B07P1YSC18,0,B07GGHVL64,Color: Blue,
01/11/2019,United States,5,Amazon Customer,Works well for visiting grandbaby,"Easy to open, close, clean and store for visits by grandchildren.",,,TRUE,https://www.amazon.com/gp/customer-reviews/R3CVT66A1C1W71/ref=cm_cr_arp_d_rvw_ttl?ie=UTF8&ASIN=B07P1YSC18,0,B07GGHVL64,Color: Blue,
01/08/2019,United States,4,Amazon Costumer,Easy to fold and travel with. Big help!,"Convenient stroller for airport travel, but the sun visor doesn’t stay snapped on very well after folding/unfolding the stroller",,,TRUE,https://www.amazon.com/gp/customer-reviews/R269LUMEFABASK/ref=cm_cr_arp_d_rvw_ttl?ie=UTF8&ASIN=B07P1YSC18,4,B07GGHVL64,Color: Blue,
01/04/2019,United States,5,Shannon McGarry,Perfect for the price!,The stroller was great for the price. My husband and I used it for our 3 year old son at Disney World. Folds up easily and enjoyed the cup holders.,,,TRUE,https://www.amazon.com/gp/customer-reviews/R1D2599IMWS2XE/ref=cm_cr_arp_d_rvw_ttl?ie=UTF8&ASIN=B07P1YSC18,50,B07GGHVL64,Color: Blue,
01/02/2019,United States,5,Debra A. Shaw,Lightweight,I bought this for a gift. Looks durable and lightweight,,,TRUE,https://www.amazon.com/gp/customer-reviews/R2JSJ8Q3PQBTKX/ref=cm_cr_arp_d_rvw_ttl?ie=UTF8&ASIN=B07P1YSC18,1,B07GGHVL64,Color: Blue,
12/27/2018,United States,5,Bruna Kirienko,Small trip stroller,We had to get a stroller for a small trip and this one was perfect!,https://images-na.ssl-images-amazon.com/images/I/81c+HdziAXL._SY1600.jpg,,TRUE,https://www.amazon.com/gp/customer-reviews/R39AYHNEYZC0EV/ref=cm_cr_arp_d_rvw_ttl?ie=UTF8&ASIN=B07P1YSC18,42,B07GGHVL64,Color: Blue,
12/17/2018,United States,3,Ray,Decent for the price but one of the button snaps for the Canopy broke when assembling.,The stroller was decent for the price. The canopy and storage is a huge plus at this price point. Unfortunately one of the button snaps on the canopy broke while attaching the canopy to the stroller. I called Summer and they suggested I return the stroller to Amazon since they don't offer replacement parts. So I returned it as defective and will be placing an order for a new one. I do wish they had other colors other than black/baby blue.,,,TRUE,https://www.amazon.com/gp/customer-reviews/R1QYGH5KOVXK0K/ref=cm_cr_arp_d_rvw_ttl?ie=UTF8&ASIN=B07P1YSC18,3,B07GGHVL64,Color: Blue,
12/14/2018,United States,5,Sarah,Great for travel - perfect for price!,"Bottom line - So happy with this umbrella stroller!!!Pros: Simple one-hand fold/unfold and went through airport security easily.I’m 5’7 and my husband is 5’10 - we were both able to maneuver well in the airport, Kennedy Space Center, Sea World and Disneywith the recline, my 2yo daughter was even able to take a nap!Handy 5-point harness and cup holders, too (like these holder strap cup holders better than the plastic clip holders).Con: small storage basket that’s not easy to access. but hey, still better than nothing!Almost bought the bigger version, but happy I got this lightweight one instead. Has everything I need at a price point I love - Would def buy again!—————-Update: after 1 year - still love this stroller. Not only great for travel but also now keep it in my car and is our “around town” stroller for my 2yo.",,,TRUE,https://www.amazon.com/gp/customer-reviews/R27CFKJUHMZLDP/ref=cm_cr_arp_d_rvw_ttl?ie=UTF8&ASIN=B07P1YSC18,174,B07GGHVL64,Color: Blue,
12/08/2018,United States,1,MARIA BAUTISTA,Horrible,"Didn’t like it at all!! Not enough space for my girl 3yrs old. The back tires doesn’t rotate. I am tall enough (168cms) más had sore back cause it is a kid of small for me, my back all sore!I can’t return it because I threw the boxes!! But will go straight to the bin next week!",,,TRUE,https://www.amazon.com/gp/customer-reviews/R3M90PRIZIO791/ref=cm_cr_arp_d_rvw_ttl?ie=UTF8&ASIN=B07P1YSC18,12,B07GGHVL64,Color: Blue,
11/29/2018,United States,5,Amazon Customer,Really great for Disney trip,"Perfect for Disney!! Basket and cup holders were necessary. Great price (I paid $50). Worth the extra from one of those $20 cheap ones. Way better quality, easier to steer, storgage etc.",,,TRUE,https://www.amazon.com/gp/customer-reviews/RR1ME5T1IZBM1/ref=cm_cr_arp_d_rvw_ttl?ie=UTF8&ASIN=B07P1YSC18,11,B07GGHVL64,Color: Blue,
05/07/2023,Canada,5,V.K.,It works!,"Hello, we needed a stroller for travel as we were uncomfortable taking our high end stroller especially when we knew our toddler is not going to use it much anyways. Ohhh boy this stroller can take a beating and still work. We were using it over very bad roads, wheels got worn out, but this stroller came back in one piece and did exactly its purpose of secondary/travel/dont care about stroller.Stroller still in good condition and works as new.",,,TRUE,,0,B07P1YSC18,Color: Gray,
05/06/2023,Canada,1,Kay,Bad Stroller,"The basket underneath is very very small therefore making it absolutely useless.The wheels are horrible, the one half of our front wheel doesn’t reach the ground so it doesn’t spin half the time. It is so difficult to turn the stroller either direction. It’s by far the worst stroller I’ve ever used.",,,TRUE,,0,B07SRVB6T6,Color: Pink/Black,
05/01/2023,Canada,5,Martin A.,great littlw stroller,use this for a 2 year old,,,TRUE,,0,B07GGHVL64,Color: Blue,
05/01/2023,Canada,2,Alicia Williams,Arrived broken,Stroller brakes are broken making it completely useless as it’s a major safety feature,,,TRUE,,0,B07SRVB6T6,Color: Pink/Black,
04/30/2023,Canada,2,Nancy,Brise vite,Cette poussette a briser après trois mois les vis arrière se sont enlevés,,,TRUE,,0,B07GGHVL64,Color: Blue,
04/29/2023,Canada,4,Parthasarathy,Very good and convenient,"This stroller is very light weight. Saves lot of boot space in car but only problem we cannot store big things under stroller because bars are blocking, still useful to store water bottles, milk and few diapers etc, over all very good choice of purchase.",,,TRUE,,1,B07GGHVL64,Color: Blue,
04/29/2023,Canada,4,Chelseay,Overall Not Bad,I enjoy how this stroller has a mini storage basket underneath as well as a cup holder. It’s more sturdy then some of the strollers I’ve used. Only issues is I find the front wheels sometimes don’t maneuver that well depending on the turn you’re making. However it works for us for what we need it for. Great price as well.,,,TRUE,,0,B07SRVB6T6,Color: Pink/Black,
04/26/2023,Canada,5,murray,Compact,"Excellent lightweight, compact stroller",,,TRUE,,0,B07P1YSC18,Color: Gray,
04/26/2023,Canada,1,Nadia,Mauvaise qualité du produit,Défectueux la première journée. Roue avant droite touche pas le sol et le pare soleil déjà déchiré.Déçu de la qualité du produit . Pour le magasinage seulement en plus.,,,TRUE,,0,B07SRVB6T6,Color: Pink/Black,
04/26/2023,Canada,5,driss elalmi,Very good stroller,"Comfy, strong and easy to fold",,,TRUE,,0,B07P1YSC18,Color: Gray,
04/25/2023,Canada,5,manju,Cadeau,Facile à plier,,,TRUE,,0,B07P1YSC18,Color: Gray,
04/25/2023,Canada,2,David Correa,Not a fan,"I was not a fan of this stroller. I purchased it for a trip to Punta Cana for my 6 month old. 3 out of the 4 wheels would stay on the ground, 1 did not reach the ground. My daughter looked extremely uncomfortable and would not nap in this stroller. The stroller did not make it after the plane ride back. 1 wheel was damaged and came off. We have the uppababy stroller at home and my daughter naps in that one no problem. Wish I didn’t purchase this stroller and brought the uppababy instead. Wouldn’t recommend.",,,TRUE,,0,B07P1YSC18,Color: Gray,
04/25/2023,Canada,3,CHR,Déçue de mon achat,"The media could not be loaded.
  
  
  
  
  
  
  
 

 

 

 

 

 

 

 

  
   Acheté pour pouvoir avoir une poussette plus petite dans la voiture...c'est la 2e fois que j'utilise la poussette...belle poussette sans plus déçue d'avoir payer ce prix...les roues avant ne touchent pas le sol et le pare soleil est deja décousue et ne reste pas attaché lorsque plier dans la voiture. Le panier en dessous est petit et le siège ne se baisse pas si l'enfant dort",,,TRUE,,0,B07P1YSC18,Color: Gray,
04/24/2023,Canada,5,Eric Kociuk,Necessary,"This stroller was perfect for our trip to Mexico. Held up in the airport, the plane and a week at our resort. Our child was comfortable in this stroller. The under carriage storage was very small and was only really usable for small items. Saw lots of other people in the airport with this stroller.",,,TRUE,,0,B07P1YSC18,Color: Gray,
04/23/2023,Canada,5,Kelly Nixon,HAPPY,"This is great for traveling, it's light weight yet sturdy.",,,TRUE,,0,B07P1YSC18,Color: Gray,
04/23/2023,Canada,3,Michelle,Stroller review,"I loved the size and the weight to carry it around.I disliked the wheels at the front, they’re kind of stiff to move. There is storage space at bottom but it’s not much.I’m the end, you pay for what you get.",,,TRUE,,0,B07GGHVL64,Color: Blue,
04/23/2023,Canada,3,Marlem,Question roue,Les roues avant ne tourne pas ce qui fait qu' elle glisse sur le sol alors je suis pas convaincu que ça va durer longtemps,,,TRUE,,0,B07GGHVL64,Color: Blue,
04/21/2023,Canada,5,Cai,Good for summer,"It’s light and convenient, easy to use",,,TRUE,,0,B07GGHVL64,Color: Blue,
04/20/2023,Canada,5,Kelcy joly vanasse,Perfect for travel,Perfect for travel,,,TRUE,,0,B07P1YSC18,Color: Gray,
04/18/2023,Canada,5,Kathleen Dickenson,Great,Great sturdy product!,,,TRUE,,0,B07SRVB6T6,Color: Pink/Black,
04/13/2023,Canada,1,SR,Disappointed ☹️,"Bought for travel, I used today but very disappointed, No backrest adjustment. The back has no hard part, wheels are not working properly, planing to return.",,,TRUE,,0,B07P1YSC18,Color: Gray,
04/12/2023,Canada,5,Lynne Caumartin,Robuste et très maniable,J’ai utiliser ça pour mes petits chiensEt c’est parfait,,,TRUE,,0,B07SRVB6T6,Color: Pink/Black,
04/12/2023,Canada,1,PB,Too heavy,Too heavy to be practical as an umbrella stroller.,,,TRUE,,0,B07GGHVL64,Color: Blue,
04/11/2023,Canada,5,Alex,Sturdy and convenient,The product is easy to assemble. Have been using for more than a month now… it is doing great.,,,TRUE,,0,B07GGHVL64,Color: Blue,
04/08/2023,Canada,3,Marc Trudel,Confortable.,Facile à utiliser pratique.Mais prends la rouille facilement au niveau des roues.,,,TRUE,,0,B07P1YSC18,Color: Gray,
04/06/2023,Canada,4,Mr Alex,Stroller mini,The stroller arrived with a long delay. She was small for a child. No backrest adjustment. The back has no hard part and looks like a hammock. Low handles. But it's light and small! Made with high quality,https://m.media-amazon.com/images/I/61uGkAtIi0L._SY1600.jpg,,TRUE,,2,B07SRVB6T6,Color: Pink/Black,
04/06/2023,Canada,4,Jacquie DeSchutter,Perfect for our needs,Bought for travel and the collapsibility. Love the height of handles,,,TRUE,,0,B07GGHVL64,Color: Blue,
04/02/2023,Canada,5,Elisha,Perfect for travelling,"Works perfectly for travelling with my 3 year old.We go to a special hospital and needed something light but sturdy for the travel and stuff we have to take with us this works really well, the only issue I have is when folding the stroller the visor pops off occasionally which can be annoying to pop back on but isn’t a big deal.I highly recommend this folding stroller 😊",,,TRUE,,2,B07SRVB6T6,Color: Pink/Black,
04/02/2023,Canada,2,L. Hamel,Disappointed - Returned item,"Instructions unclear on how to attach canopy. Once opened up stroller, almost impossible to close it. I have no doubt that others are pleased with the stroller. This one didn't work for me.",,,TRUE,,0,B07P1YSC18,Color: Gray,
04/02/2023,Canada,5,Client d'Amazon,poussette,Parfait et très abordable.,,,TRUE,,0,B07GGHVL64,Color: Blue,
04/01/2023,Canada,5,Andrea,Amazing,"So happy with my purchase, great for travel or to just keep in the car for the mall trips. Steers easily, gold easily, light weight and has storage, even for your coffee mommas!! Highly recommend!",,,TRUE,,1,B07P1YSC18,Color: Gray,
03/31/2023,Canada,2,AVALEISHA,Smaller than expected,"Stroller is very small, should be worth $60 instead of $90 after taxes. If you have a heavier toddler wouldn’t recommend. I’ve paid $100 for a bigger and sturdier lightweight stroller, so for this one to be $90 and so small I was a little disappointed.",,,TRUE,,0,B07SRVB6T6,Color: Pink/Black,
03/30/2023,Canada,5,Kim & Antho,Love it!,"I love it! Easy to fold/unfold, light and confortable for my toddler.Only downside is the sun cover mecanism, it's really cheap and keeps coming off on one side when I pull it down. I'll have to put a tie wrap or something to hold it in place.",,,TRUE,,1,B07P1YSC18,Color: Gray,
03/30/2023,Canada,5,SarahM,Awesome quality for the price!,Worked great on our Mexico trip! Was really impressed with the quality for the price.,,,TRUE,,0,B07P1YSC18,Color: Gray,
03/29/2023,Canada,4,Cathy St. Clair,"It’s cute and light and serves its purpose, for a Nana stroller, easy on the back.","As a senior and Grandmother, this is ideal as it’s lightweight, useful and attractive. Only issue is my Grandsons feet do not reach the foot rest so his feet and legs just dangle down. I would not use this stroller as the primary one.",,,TRUE,,1,B07GGHVL64,Color: Blue,
03/29/2023,Canada,4,Effat,Super cute in person and easy to push,"I like the size a lot, the strap is easy to use and the wheels are strong","https://m.media-amazon.com/images/I/61a78rCqPEL._SY1600.jpg, https://m.media-amazon.com/images/I/71FyVb9XmhL._SY1600.jpg",,TRUE,,3,B07SRVB6T6,Color: Pink/Black,
03/29/2023,Canada,5,Valeria Buitron,Practical & light weight,"Bought this stroller for a trip and it was very practical. Easy to fold, light and easy to buckle. Would definitely recommend it!",,,TRUE,,0,B07GGHVL64,Color: Blue,
03/23/2023,Canada,3,Funmi Oke,"Decent stroller, just not my cup of tea","I just moved to Canada and the airline misplaced my primary stroller, so i needed to get one to get by, hence why i picked this. My son is 2 year old and barely fits into the stroller, and it seemed a little too low for me to manage, and i am 5ft 4inches. Its however nicely compact but i struggled every-time i needed to pack it up for storage. Other than that, it did the job of moving my son from one place to another, but it just wasnt my cup of tea.",,,TRUE,,0,B07SRVB6T6,Color: Pink/Black,
03/21/2023,Canada,1,Amazon Customer,No quality,Cheap quality…,,,TRUE,,0,B07P1YSC18,Color: Gray,
03/19/2023,Canada,3,Voodoomamajuju,Lightweight but faulty,"I was going to return this stroller but decided against it because we use it to stroll my toddler to sleep sometimes when she is fussy inside the house.Originally, I bought this stroller for travel. It is lightweight and compact. Easy to put together.The major issue is the wheels at the front, eapecially the right side are not level. Once the kid is in, the wheels glide above the floor so turning corners is somewhat of an issue with this stroller. This is a major problem. I mean a stroller is supposed to stroll. The wheels are the basic part of the stroller. How do you mess that up?",,,TRUE,,1,B07P1YSC18,Color: Gray,
03/18/2023,Canada,5,Suzanne Choiniere,"Très solide, facile à rouler, bébé bien confortable. Excellent article.","Très léger et compacte, se place bien dans valise d'auto ou porte bagage d'avion",,,TRUE,,0,B07P1YSC18,Color: Gray,
03/14/2023,Canada,1,Hanny,Don't recommend this for 2+ years old,"I bought this product because needed something more compact but first, the front wheel don't turn and they barely move when you're turning, which make it hard, and if you have a 2year old or older, this will be way too small, the area to storage things is not easy to get things. I just DON'T recommend this stroller, unless you're in a budget and can't afford something else. I have to return this because my 2yo is too big for it.",,,TRUE,,0,B07SRVB6T6,Color: Pink/Black,
03/14/2023,Canada,5,Vinit Bhavthankar,Amazing,Like it,"https://m.media-amazon.com/images/I/712hCdhTYnL._SY1600.jpg, https://m.media-amazon.com/images/I/71FpMVCZN9L._SY1600.jpg",,TRUE,,0,B07GGHVL64,Color: Blue,
03/12/2023,Canada,5,Kassandra Lemarbre,Poussette parfaite,"Parfait au niveau grandeur, parfait au niveau de l'espace que la poussette occupe",,,TRUE,,0,B07SRVB6T6,Color: Pink/Black,
03/12/2023,Canada,5,Valeriya,Nice,Nice summer light stroller for the price,,,TRUE,,0,B07P1YSC18,Color: Gray,
03/10/2023,Canada,5,Sameer,Amazing product for the price,We were very pleasantly surprised at the great quality of this stroller.,,,TRUE,,0,B07P1YSC18,Color: Gray,
03/09/2023,Canada,3,Olivia V,Cheap,"Regret this purchase. It's very cheap feeling, the wheels don't turn enough so you end up dragging the stroller. Wish I just spent a little more on better quality.",,,TRUE,,0,B07GGHVL64,Color: Blue,
03/08/2023,Canada,4,Amylicia,Is it normal?,A great compact light weight stroller for travelling. It was very easy assembly and so glad I got this to travel alone with my baby. It was light enough to carry and put them up and down with one hand. Easy to push. Only 1 downside is the one side of top piece kept snapping off whenever I fold the stroller down and was kind of annoying I had to snap it back. Otherwise I find this stroller very helpful and worth the price!,,,TRUE,,1,B07SRVB6T6,Color: Pink/Black,
03/07/2023,Canada,5,Francis J. Moore,As Advertised,The stroller is very light and therefore easy to handle.,,,TRUE,,0,B07P1YSC18,Color: Gray,
03/06/2023,Canada,5,louise daigle,facile a plier,pour promener bebe en toute securite compacte et vite arriver merci,,,TRUE,,0,B07P1YSC18,Color: Gray,
03/03/2023,Canada,4,CarissaRich,Reviews,"After reading some reviews saying it would fit biggers kids , it is far from true. Bought it for travelling with a 3 year old girl. Wouldn’t recommend it, for anything older. Other than that it seems alright.",,,TRUE,,3,B07P1YSC18,Color: Gray,
03/01/2023,Canada,5,Brenda Stacey,"It's light but sturdy,I really liked all the extras like the bottle or cup holders.",Very easy to fold.,,,TRUE,,0,B07GGHVL64,Color: Blue,
02/25/2023,Canada,1,Jami,Not good,This product is not good at all. It’s hard to pull,,,TRUE,,0,B07P1YSC18,Color: Gray,
02/24/2023,Canada,1,Sarah R,Used product being sold as new,"Purchased this item understanding that it was new, it arrived assembled, with clearly used tires and the canopy missing. Would give a zero star if possible",https://m.media-amazon.com/images/I/71-x4YzprYL._SY1600.jpg,,TRUE,,2,B07P1YSC18,Color: Gray,
02/23/2023,Canada,5,PM,Like this,"Bought this for my grand-daughter's use and it fits the bill as a lightweight, portable stroller.",,,TRUE,,0,B07P1YSC18,Color: Gray,
02/22/2023,Canada,1,Caroline,Pire poussette ever,Les roues en avant ne touchent pratiquement pas par terre. Je l’avais acheter pour notre voyage…! Finalement elle ira a la poubelle. Ne gaspillez pas votre argent!!,,,TRUE,,1,B07P1YSC18,Color: Gray,
02/22/2023,Canada,1,Amazon Customer,Cheap plastic joints and buckles,"We have had this stroller for about a month now, the cheap plastic pieces on the strap and elbow holding the wheels have broken. Save some money and buy a stronger stroller. We wanted a light weight stroller for traveling but unfortunately this one isn't making the trip as it's already broken.",,,TRUE,,1,B07SRVB6T6,Color: Pink/Black,
02/21/2023,Canada,4,AnnickPerrault,Correct. Le rangement est bon,Compacte mais pas si compactJ’aurais aimé qu’elle rentre dans ma valise mais pas en angleLes compartiments de rangements sont okElle se manœuvre correctement,https://m.media-amazon.com/images/I/81aSWQ+LEXL._SY1600.jpg,,TRUE,,5,B07P1YSC18,Color: Gray,
02/21/2023,Canada,2,Maude,Fait très cheap! Zip brisé en moins d’une semaine,Fait très cheap.Moins d’une semaine d’utilisation et le zip a déjà lâché,,,TRUE,,0,B07P1YSC18,Color: Gray,
02/17/2023,Canada,3,Mushfiqur Rahman,Light weight but average Product,It is not an easy work to fold it. The lower folding rod is very had to close. And the finishing is not that much good.,,,TRUE,,0,B07P1YSC18,Color: Gray,
02/10/2023,Canada,5,Phil & Nina,Great gift,Purchased as a gift for my niece when they are travelling! Awesome 👏,,,TRUE,,0,B07P1YSC18,Color: Gray,
02/10/2023,Canada,1,Jo,Wheel broke after one use at the airport,The wheel broke after one use at the airport. There’s no way for me to return it since I can’t carry it back to return it. Rather pay more and get a better quality one,,,TRUE,,1,B07P1YSC18,Color: Gray,
02/09/2023,Canada,5,Patricia Gross,Easy to use,Came in on time. Was easy to put up and down. Light weight too. Granddaughter was very comfortable in her new stroller,,,TRUE,,0,B07P1YSC18,Color: Gray,
02/06/2023,Canada,1,Jason Flynn,Not worth the money,"We bought two of these strollers prior to leaving on vacation, and we were extremely disappointed with the quality. The strollers are cheaply made, and they are hard to steer. Not all of the wheels touch the ground, so they are very unstable.",,,TRUE,,1,B07P1YSC18,Color: Gray,
