Date,Country/Location,Rating,Author,Title,Body,Image links,Image Video Links,Verified Purchase,URL,Helpful count,Variation information,Styles,
07/22/2022,United States,1,Leslie McNeal,Horrible,"Horrible, didn’t turn, when you close it up and open it back up the umbrella look like a cone. Smh worst purchase ever",,,TRUE,https://www.amazon.com/gp/customer-reviews/R1SEK7ZT0ZS7CW/ref=cm_cr_arp_d_rvw_ttl?ie=UTF8&ASIN=B07P1YSC18,1,B07SRVB6T6,Color: Pink/Black,
07/21/2022,United States,1,Brittany,Lied on the product dimensions,"The media could not be loaded.
  
  
  
  
  
  
  
  
 

 

 

 

 

 

 

 

  
  
   I specifically needed a stroller for tall people. Says that it’s 43-44 inches in height and it’s not. The stroller is 39 inches tall.",,,TRUE,https://www.amazon.com/gp/customer-reviews/R3BI2DTRINDZU3/ref=cm_cr_arp_d_rvw_ttl?ie=UTF8&ASIN=B07P1YSC18,4,B07GGHVL64,Color: Blue,
07/21/2022,United States,5,Rachael E Chase,Love it!,I got this stroller as a back up when I need to be able to put my stroller inside my truck. It fits inside the truck and is easy to use and easy to adjust.,,,TRUE,https://www.amazon.com/gp/customer-reviews/R3EKSNLJH25SEC/ref=cm_cr_arp_d_rvw_ttl?ie=UTF8&ASIN=B07P1YSC18,0,B07GGHVL64,Color: Blue,
07/20/2022,United States,5,Bianca,Fits in airplane aisle,Best simple stroller when traveling,,,TRUE,https://www.amazon.com/gp/customer-reviews/R3PH2EW7AL8I3L/ref=cm_cr_arp_d_rvw_ttl?ie=UTF8&ASIN=B07P1YSC18,1,B07SRVB6T6,Color: Pink/Black,
07/20/2022,United States,1,Mell,It’s garbage don’t waste your money,It’s garbage don’t waste your money,,,TRUE,https://www.amazon.com/gp/customer-reviews/RMOKNWPMCWMFL/ref=cm_cr_arp_d_rvw_ttl?ie=UTF8&ASIN=B07P1YSC18,1,B07GGHVL64,Color: Blue,
07/20/2022,United States,5,Desiree Phillips,Great Stroller,"Great, affordable and light weight stroller. I would definitely recommend.",,,TRUE,https://www.amazon.com/gp/customer-reviews/RTQFXV3NYCA4B/ref=cm_cr_arp_d_rvw_ttl?ie=UTF8&ASIN=B07P1YSC18,0,B07GGHVL64,Color: Blue,
07/20/2022,United States,1,Destiny Veasley,Great until it isn’t…,"I absolutely LOVED this product. It is light weight and easy to use. The cup holder is flimsy so I would suggest using a water bottle like 16.9 ounce. Not a tumbler it doesn’t hold well.After a few months of use the latch that keep the stroller open, isn’t locking. My return window closed on June 3. I just tired to reach out to the manufacturer, to see what they can do. Will update y’all on how it goes.",,,TRUE,https://www.amazon.com/gp/customer-reviews/RYLYGIFPCCRYQ/ref=cm_cr_arp_d_rvw_ttl?ie=UTF8&ASIN=B07P1YSC18,1,B07GGHVL64,Color: Blue,
07/19/2022,United States,2,Maureen Davis,Does not turn well ….,We purchased to have a lighter weight stroller and haven’t used it more than once - would not recommend.,,,TRUE,https://www.amazon.com/gp/customer-reviews/R296XZB683PS8Z/ref=cm_cr_arp_d_rvw_ttl?ie=UTF8&ASIN=B07P1YSC18,0,B07GGHVL64,Color: Blue,
07/19/2022,United States,3,Michelle,Simple stroller,"Definitely a cheaper stroller. lightweight and easy to fold. Doubt it will last very long. Had for 2 months now and it does what i need. Bottom storage is pointless, hard to use and doesnt hold much",,,TRUE,https://www.amazon.com/gp/customer-reviews/R2ML0DCKN2OLCH/ref=cm_cr_arp_d_rvw_ttl?ie=UTF8&ASIN=B07P1YSC18,2,B07P1YSC18,Color: Gray,
07/19/2022,United States,3,Amazon Customer,Not easy to steer,The back wheel is wobbly and it’s not easy to steer in a crowd.,,,TRUE,https://www.amazon.com/gp/customer-reviews/R5Y4O6DBXKMWK/ref=cm_cr_arp_d_rvw_ttl?ie=UTF8&ASIN=B07P1YSC18,0,B07P1YSC18,Color: Gray,
07/19/2022,United States,5,Mary Tupper,Stroller,Great product,,,TRUE,https://www.amazon.com/gp/customer-reviews/R1NYNT0SHMFM1X/ref=cm_cr_arp_d_rvw_ttl?ie=UTF8&ASIN=B07P1YSC18,0,B07GGHVL64,Color: Blue,
07/19/2022,United States,5,Myjboyz,Nice,"Very nice, not quite the right size for a toddler, it’s a little too small. Grandson is 35 pounds but tall, so his feet hang over.",,,TRUE,https://www.amazon.com/gp/customer-reviews/R3TCHHYIT3DO5M/ref=cm_cr_arp_d_rvw_ttl?ie=UTF8&ASIN=B07P1YSC18,0,B07P1YSC18,Color: Gray,
07/18/2022,United States,3,BD,"Cheap, but it worked in a pinch","We were nearly to the airport when we realized that we forgot our stroller. This was the least expensive lightweight stroller I could find that could be delivered to our hotel in a timely fashion. Cheap is the word, it was hard to steer, especially on anything other than sidewalks, like gravelly sidewalks. I wouldn’t but for a full time stroller but if you need something cheap in a pinch, it will work for that, for a couple of weeks anyway.",,,TRUE,https://www.amazon.com/gp/customer-reviews/RUUGZ07H6EG2J/ref=cm_cr_arp_d_rvw_ttl?ie=UTF8&ASIN=B07P1YSC18,0,B07P1YSC18,Color: Gray,
07/18/2022,United States,4,Katherine N. Kaup,Great for the price,Don’t for see if lasting too long. Def works for a regular stroller that you need to fold up small. I use at “grandmas house”. Wheels aren’t great but otherwise totally fine.,,,TRUE,https://www.amazon.com/gp/customer-reviews/R310S7XN8NF4BB/ref=cm_cr_arp_d_rvw_ttl?ie=UTF8&ASIN=B07P1YSC18,0,B07GGHVL64,Color: Blue,
07/17/2022,United States,4,Julie A Bower,Not bad for an inexpensive stroller,Easy to put together and fold up,,,TRUE,https://www.amazon.com/gp/customer-reviews/ROTS155PB1906/ref=cm_cr_arp_d_rvw_ttl?ie=UTF8&ASIN=B07P1YSC18,0,B07P1YSC18,Color: Gray,
07/17/2022,United States,5,Jordan Foster,Why didn’t I buy this sooner?,"Between two kids, we’ve gone through 4 strollers. This is my instant favorite stroller! It is easy to push with one hand, lightweight, and folds up small. I love the built-in cup holder and zipper pouch and area underneath. Most importantly it doesn’t take up my entire trunk. We got this for traveling and it’s the perfect stroller for that!",,,TRUE,https://www.amazon.com/gp/customer-reviews/RMDV1R2XONA4Q/ref=cm_cr_arp_d_rvw_ttl?ie=UTF8&ASIN=B07P1YSC18,1,B07SRVB6T6,Color: Pink/Black,
07/16/2022,United States,3,anjellyca,Front wheel doesn’t turn,"Purchased this to take on a trip as our City Select is SO heavy and difficult to travel with. I love how easy it folds & it is about half the weight of the Baby Jogger City Select. What I do not like is that the front wheel doesn’t turn. Sometimes it doesn’t even spin. I imagine if it worked properly I would’ve rated this stroller 5 stars, but because it makes it difficult to maneuver when turning, I cannot give it 5 stars. I don’t regret purchasing it for this trip and avoiding the hassle of our huge city select stroller.",,,TRUE,https://www.amazon.com/gp/customer-reviews/R31LNEZ9GHLBV9/ref=cm_cr_arp_d_rvw_ttl?ie=UTF8&ASIN=B07P1YSC18,1,B07P1YSC18,Color: Gray,
07/15/2022,United States,1,Lina botero,Las llantas delanteras no giran,Esta liviano y bonito pero las ruedas delanteras no son giratorias,,,TRUE,https://www.amazon.com/gp/customer-reviews/R2YDFUDYDWGP46/ref=cm_cr_arp_d_rvw_ttl?ie=UTF8&ASIN=B07P1YSC18,0,B07SRVB6T6,Color: Pink/Black,
07/15/2022,United States,5,Joy,Great purchase for the money,"Use this for our granddaughter, very easy to put together and ease of use.",,,TRUE,https://www.amazon.com/gp/customer-reviews/R3RDRX3MRSP96T/ref=cm_cr_arp_d_rvw_ttl?ie=UTF8&ASIN=B07P1YSC18,0,B07P1YSC18,Color: Gray,
07/15/2022,United States,5,Selena Mota,Great stroller!,I was pretty pleased with this stroller! Affordable and does it’s job! 👍🏼👍🏼👍🏼,,,TRUE,https://www.amazon.com/gp/customer-reviews/R2DBLFWR7QPS8U/ref=cm_cr_arp_d_rvw_ttl?ie=UTF8&ASIN=B07P1YSC18,0,B07SRVB6T6,Color: Pink/Black,
07/14/2022,United States,1,JBrough,It Ain't Got That Swing,"This stroller is lightweight, and so is the fabric. If you're planning on taking this baby for a turn around the dance floor, forget it. The front wheels do not move, (although from the photo, they look like they swivel...alas, no), so there is no do-si-do, only a straight promenade.",,,TRUE,https://www.amazon.com/gp/customer-reviews/R3VE3QOM4KL0MC/ref=cm_cr_arp_d_rvw_ttl?ie=UTF8&ASIN=B07P1YSC18,1,B07P1YSC18,Color: Gray,
07/13/2022,United States,3,Beautiful optimistic,FIRST STARTER STROLLER,It needs to be more weight like 10lbs and to recline should be a release button not a push and release strap.,,,TRUE,https://www.amazon.com/gp/customer-reviews/R31WJYGNLXHSFY/ref=cm_cr_arp_d_rvw_ttl?ie=UTF8&ASIN=B07P1YSC18,0,B07P1YSC18,Color: Gray,
07/13/2022,United States,4,Seth,"Decent, get what you pay for","I like everything about this stroller except for two things: the cargo area has crossbars in front of it so it isn’t very accessible and the quality. The wheels are cheap and don’t maneuver as well as I would like. However, the built-in cup holder and storage is really nice. If you’re looking for a decent stroller that is great for limited travel space, this does the job.",,,TRUE,https://www.amazon.com/gp/customer-reviews/R2BTRU7BFSHQZW/ref=cm_cr_arp_d_rvw_ttl?ie=UTF8&ASIN=B07P1YSC18,1,B07GGHVL64,Color: Blue,
07/12/2022,United States,1,Erendira Pineda,Bad product was broken . I had to pay 30.00 for send back the stroller.,Bad quality. It was broken . I had to pay $30:00 to UPS for return the product. I lost that money. I will give 00000 for rating,https://m.media-amazon.com/images/I/71YVgtcY5xL._SY1600.jpg,,TRUE,https://www.amazon.com/gp/customer-reviews/R1XNK2G6ZJM9GH/ref=cm_cr_arp_d_rvw_ttl?ie=UTF8&ASIN=B07P1YSC18,1,B07P1YSC18,Color: Gray,
07/12/2022,United States,1,SR,Used item delivered,This was delivered used! I had to return and order a replacement.,,,TRUE,https://www.amazon.com/gp/customer-reviews/R151CRKB4CKX6M/ref=cm_cr_arp_d_rvw_ttl?ie=UTF8&ASIN=B07P1YSC18,1,B07P1YSC18,Color: Gray,
07/11/2022,United States,5,Andrew,Perfect for Travel,We wanted a smaller and lightweight stroller to take on our first international trip with our 1 year old. It was perfect! We would recommend it.,,,TRUE,https://www.amazon.com/gp/customer-reviews/R1YHT79DPLAVDZ/ref=cm_cr_arp_d_rvw_ttl?ie=UTF8&ASIN=B07P1YSC18,0,B07P1YSC18,Color: Gray,
07/11/2022,United States,4,Marina,So so product,"I guess I only love the price of this stroller. Other than the price, the stroller is not easy to fold for me, it is hard to push it, it is flimsy. I'm not very happy with it unfortunately...",,,TRUE,https://www.amazon.com/gp/customer-reviews/RRMKRM7A1Q91M/ref=cm_cr_arp_d_rvw_ttl?ie=UTF8&ASIN=B07P1YSC18,0,B07SRVB6T6,Color: Pink/Black,
07/10/2022,United States,5,moises l ayala,Very good,Very naice,,,TRUE,https://www.amazon.com/gp/customer-reviews/RJC7ZL3QMXA3U/ref=cm_cr_arp_d_rvw_ttl?ie=UTF8&ASIN=B07P1YSC18,0,B07P1YSC18,Color: Gray,
07/10/2022,United States,1,Salondric and Allison Armour,Crap,Sent it with a broken wheel. to small and hard to push,,,TRUE,https://www.amazon.com/gp/customer-reviews/RA81ER7M9X67F/ref=cm_cr_arp_d_rvw_ttl?ie=UTF8&ASIN=B07P1YSC18,1,B07GGHVL64,Color: Blue,
07/10/2022,United States,3,Amazon Customer,cheap,for $50 it's cheaply made which I'm disappointed.,,,TRUE,https://www.amazon.com/gp/customer-reviews/RIJIQGS3YPMY7/ref=cm_cr_arp_d_rvw_ttl?ie=UTF8&ASIN=B07P1YSC18,1,B07GGHVL64,Color: Blue,
07/10/2022,United States,4,Brittney Bush,Lightweight and Maneuverable,"The stroller is lightweight, maneuverable and I love the gray and black color combination. The only thing I would change is a bigger storage compartment at the bottom.",,,TRUE,https://www.amazon.com/gp/customer-reviews/R3GXH1F5G4Y34O/ref=cm_cr_arp_d_rvw_ttl?ie=UTF8&ASIN=B07P1YSC18,0,B07P1YSC18,Color: Gray,
07/10/2022,United States,3,J.Castro,The canopy keeps coming off,canopy keeps coming off on one side every time I unfold the stroller.,,,TRUE,https://www.amazon.com/gp/customer-reviews/R2XG1NONZTG0L2/ref=cm_cr_arp_d_rvw_ttl?ie=UTF8&ASIN=B07P1YSC18,0,B07P1YSC18,Color: Gray,
07/09/2022,United States,1,Knitty,Folds eventually if you turn it upside down and bang on the bottom repeatedly with your shoes,"Wish I could return this!Bought this stroller specifically to take on the NYC subway. The weight is OK but the fold is impossible — I had to turn the whole thing upside down and then basically stomp on the folding mechanism to get it to budge. We ended up carrying the whole thing up and down the subway stairs at every station. I would never recommend this stroller for use on public transit.My recommendation for bus or train: Either buy the $20-$30 cheapie umbrella stroller, which would fold better than this one and be smaller and lighter, OR get the Uppababy G-Lite, OR get the Yo-yo.",,,TRUE,https://www.amazon.com/gp/customer-reviews/R3U70B8KFCEEET/ref=cm_cr_arp_d_rvw_ttl?ie=UTF8&ASIN=B07P1YSC18,3,B07SRVB6T6,Color: Pink/Black,
07/08/2022,United States,5,Lorena,I love it,"Hermoso , ligero, suave de manejar, tiene bolsillos, lo necesitaba para el aeropuerto y entra hasta el asiento de carro encima.. perfecto para viajar..","https://m.media-amazon.com/images/I/71HLWmes93L._SY1600.jpg, https://m.media-amazon.com/images/I/81vNnHAZd1L._SY1600.jpg",,TRUE,https://www.amazon.com/gp/customer-reviews/R1J1A775AX85J/ref=cm_cr_arp_d_rvw_ttl?ie=UTF8&ASIN=B07P1YSC18,1,B07P1YSC18,Color: Gray,
07/08/2022,United States,2,Kas,Not Impressed,I was never impressed with this stroller. I wanted a lighter weight stroller for my son (now 21 months). The front wheels never worked properly. All of them are not on the ground at the same time which makes steering impossible and annoying. Also the sun visor was bent in the box and never went back to the correct shape so after a few weeks I removed it. If everything worked properly it would be a good stroller for the price. It is lightweight and easy to pack in the car. The bottom pouch doesn't hold much but that's not a big deal for us. Back in the market for a new stroller since the one I received was not build well.,,,TRUE,https://www.amazon.com/gp/customer-reviews/RM69FB1W334JW/ref=cm_cr_arp_d_rvw_ttl?ie=UTF8&ASIN=B07P1YSC18,1,B07GGHVL64,Color: Blue,
07/08/2022,United States,1,Larkin's Surplus,"Cheap, wheels don’t rotate","I just bought this stroller for a trip and we are about to go to Walmart and buy something else. The front wheels are not balanced so one wheel doesn’t touch the ground. Plus the front wheels don’t turn. It is so hard to maneuver. For the money, you would be better off with a $20 stroller from Walmart.",,,TRUE,https://www.amazon.com/gp/customer-reviews/R2Z80W354IH9VN/ref=cm_cr_arp_d_rvw_ttl?ie=UTF8&ASIN=B07P1YSC18,1,B07SRVB6T6,Color: Pink/Black,
07/07/2022,United States,4,Kassidy,Good for price,It does what it needs to. It’s a good stroller just sometimes hard to maneuver just feels a little cheap but I knew with the price not to expect perfection. I’d buy again though,,,TRUE,https://www.amazon.com/gp/customer-reviews/R23OWZT2PM8R0V/ref=cm_cr_arp_d_rvw_ttl?ie=UTF8&ASIN=B07P1YSC18,0,B07P1YSC18,Color: Gray,
07/07/2022,United States,1,Kelly,Unusable stroller,Stroller kept folding on my son while he was in it!,,,TRUE,https://www.amazon.com/gp/customer-reviews/R35OQUZCH62K5X/ref=cm_cr_arp_d_rvw_ttl?ie=UTF8&ASIN=B07P1YSC18,1,B07GGHVL64,Color: Blue,
07/07/2022,United States,4,Quiana Garner,Easy assembly and lightweight,"It came pretty much already assembled. Just had to snap on the wheels and attach the canopy. Very mom friendly. The only reason I rated 4 stars is because I havent used it yet, Im rating solely off of quality and assembly.",,,TRUE,https://www.amazon.com/gp/customer-reviews/RKM1IFAHA8H9M/ref=cm_cr_arp_d_rvw_ttl?ie=UTF8&ASIN=B07P1YSC18,1,B07P1YSC18,Color: Gray,
07/07/2022,United States,2,Hope Nugent,The worst,The umbrella cover keep coming off and the wheels don't work good.,,,TRUE,https://www.amazon.com/gp/customer-reviews/R105Z1QMAGNJ3L/ref=cm_cr_arp_d_rvw_ttl?ie=UTF8&ASIN=B07P1YSC18,0,B07P1YSC18,Color: Gray,
07/06/2022,United States,1,Sara,Not worth it.,"Bought this for three days at Disney world, didn’t even last that before the handle covers peeled off. It’s extremely uncomfortable to push without the cover. Wouldn’t suggest it.",,,TRUE,https://www.amazon.com/gp/customer-reviews/R27W3XKIQRKMFO/ref=cm_cr_arp_d_rvw_ttl?ie=UTF8&ASIN=B07P1YSC18,1,B07P1YSC18,Color: Gray,
07/06/2022,United States,5,denny,Great stroller,Great price for the stroller. However the canopy isn’t big enough to shade baby’s head! Still I’ll be using this for walks with my 9 month old Grandson,,,TRUE,https://www.amazon.com/gp/customer-reviews/RF17DII4RMLPV/ref=cm_cr_arp_d_rvw_ttl?ie=UTF8&ASIN=B07P1YSC18,0,B07P1YSC18,Color: Gray,
07/06/2022,United States,1,Joe,Cheap. Don’t buy.,Worst stroller I ever got. I regret this buy.,,,FALSE,https://www.amazon.com/gp/customer-reviews/R1KHICYY78INAJ/ref=cm_cr_arp_d_rvw_ttl?ie=UTF8&ASIN=B07P1YSC18,0,B07GGHVL64,Color: Blue,
07/05/2022,United States,5,Kate Fox,A great lightweight stroller,"I opted for this rather than a normal umbrella stroller and am glad I did. It was simple to put together. Very lightweight yet also sturdy. Extremely simple to open and close, and it latches itself when closed, so it won’t open again unless you want it to. The cup holders and basket are helpful also. The basket underneath isn’t large but still handy to have! The harness straps adjust easily also. All in all a great simple stroller!",,,TRUE,https://www.amazon.com/gp/customer-reviews/R2WQDJNDA5K8G2/ref=cm_cr_arp_d_rvw_ttl?ie=UTF8&ASIN=B07P1YSC18,0,B07P1YSC18,Color: Gray,
07/05/2022,United States,5,Kinley Farr,Easy to use!,This is a very lightweight and easy to use stroller. Opens and folds closed very easily. My 8 month old granddaughter is very comfortable in it. My daughter actually has a larger stroller but often prefers to use this one since it’s more compact. Takes up very little space in the trunk of my car.,,,TRUE,https://www.amazon.com/gp/customer-reviews/R1LB58XQA3E39T/ref=cm_cr_arp_d_rvw_ttl?ie=UTF8&ASIN=B07P1YSC18,0,B07P1YSC18,Color: Gray,
07/05/2022,United States,1,Sima Narine,Garbage,Very Poor Quality 100% garbage,,,TRUE,https://www.amazon.com/gp/customer-reviews/R85F618O3YG4N/ref=cm_cr_arp_d_rvw_ttl?ie=UTF8&ASIN=B07P1YSC18,1,B07P1YSC18,Color: Gray,
07/03/2022,United States,4,Isabell Parker,Great inexpensive stroller,I wanted something to push around the yard on the few days a week I watch the grandbaby.This works great for that and has no problem rolling through the grass yard. The canopy provides enough shade and it seems comfortable - my grandbaby is 6 months And I’m sure he’s going to fit in this for a long time to come. I like that the wheels lock so it doesn’t roll unless I want it to.On a hard surface one of the double front wheels doesn’t completely touch the ground - But it didn’t bother me enough to send it back for a refund it works just fine.,,,TRUE,https://www.amazon.com/gp/customer-reviews/R1E50OSWBK4NJ2/ref=cm_cr_arp_d_rvw_ttl?ie=UTF8&ASIN=B07P1YSC18,2,B07GGHVL64,Color: Blue,
07/03/2022,United States,5,Brandon Erlacher,"Simple, inexpensive easy-to-fold stroller!",We got this to keep at our house for our grand child. The price was right and it fits the bill. Easy to fold and lightweight.,,,TRUE,https://www.amazon.com/gp/customer-reviews/R1W5ZH8LDMPWC0/ref=cm_cr_arp_d_rvw_ttl?ie=UTF8&ASIN=B07P1YSC18,0,B07GGHVL64,Color: Blue,
07/03/2022,United States,3,allison,It stains easily and doesn't feel strong enough to hold toddler in seat,Not strong enough to hold toddler in seat,,,TRUE,https://www.amazon.com/gp/customer-reviews/R1WVDGDSLQ8TQB/ref=cm_cr_arp_d_rvw_ttl?ie=UTF8&ASIN=B07P1YSC18,1,B07GGHVL64,Color: Blue,
07/03/2022,United States,3,KaylaB,Hate it,"I cannot describe how annoying this stroller is. There is next to no room in the basket underneath, the canopy might as well not even be there and the wheels don’t even all roll together. I just hate this stroller. Umbrella strollers yuck!",,,TRUE,https://www.amazon.com/gp/customer-reviews/RPXN3NAAAW1E1/ref=cm_cr_arp_d_rvw_ttl?ie=UTF8&ASIN=B07P1YSC18,0,B07GGHVL64,Color: Blue,
07/02/2022,United States,2,Amazon Customer,Rear wheel axels bent,"The good: light weight, inexpensive compare to others, easy to use.The bad: front “straight” wheel lock engages often, only reclines half way (both of these problems aren’t really a big deal). The big problem; rear axels bent and now it’s too difficult to pushWe bought for a vacation and it made it through that so it served its purpose…if it weren’t for the rear tires being all cattywhampus we’d probably still be using it often for the convenience as a small trunk stroller",,,TRUE,https://www.amazon.com/gp/customer-reviews/R1RI1NSNQSTB0R/ref=cm_cr_arp_d_rvw_ttl?ie=UTF8&ASIN=B07P1YSC18,0,B07P1YSC18,Color: Gray,
07/02/2022,United States,5,Rachel M Ball,Great every-day lite-duty stroller,"Absolutely love this stroller! It is light weight, though not as light as some similar strollers. The basket is tiny but has been a bonus compared to the cheap Walmart umbrella stroller I picked up. The cup holder pouch holds my refillable water bottle without the bottle toppling out like it does in my Graco Verb. The sunshade covers quite a bit which is perfect for how much time we spend outdoors. For an umbrella stroller it maneuvers faily well, but does tend to pull or get stuck on bumps. So glad I bought this as a more compact option for quick outings and traveling!",,,TRUE,https://www.amazon.com/gp/customer-reviews/R219R5R42DMI3A/ref=cm_cr_arp_d_rvw_ttl?ie=UTF8&ASIN=B07P1YSC18,1,B07GGHVL64,Color: Blue,
07/02/2022,United States,5,Mauri,Perfect Lightweight,"This is absolutely perfect for traveling! It folds easy, moves great, and perfect for travel. It is now my go to airport pick for small kids!",,,TRUE,https://www.amazon.com/gp/customer-reviews/R1FO4Y01RCSZU2/ref=cm_cr_arp_d_rvw_ttl?ie=UTF8&ASIN=B07P1YSC18,0,B07P1YSC18,Color: Gray,
07/01/2022,United States,2,Tashika Amy,front wheels dont move right,The front wheel don't turn the right way. sometimes one or more of the wheels dont move at all. the pull tab on the back of the seat is really not supported,,,TRUE,https://www.amazon.com/gp/customer-reviews/RRYC4347ZGLUI/ref=cm_cr_arp_d_rvw_ttl?ie=UTF8&ASIN=B07P1YSC18,0,B07GGHVL64,Color: Blue,
07/01/2022,United States,1,Dee,Piece of Junk,This is a piece of junk it came to my house with the box busted up & holes in it! The wheels are cheap plastic and look like they have been used this was clearly a return directly shipped to me! The place for the baby to rest their feet is cheap plastic it’s just a cheap stroller overall the canopy is a joke . I was so excited to finally take my baby out this weekend with my stroller to find that i can’t even use it.,"https://m.media-amazon.com/images/I/71+B6WAI-ML._SY1600.jpg, https://m.media-amazon.com/images/I/81yCI3wzqvL._SY1600.jpg",,TRUE,https://www.amazon.com/gp/customer-reviews/R7AQT01UDGH48/ref=cm_cr_arp_d_rvw_ttl?ie=UTF8&ASIN=B07P1YSC18,3,B07P1YSC18,Color: Gray,
06/30/2022,United States,3,Kaycee,Should be cheaper...,"I do like how light weight and easy this stroller is to fold. I like the zipper pocket at the top. However, there are 2 wheels on each side at the front. Only one of those wheels actually touch the ground. The metal bar like thing you push up and down with your foot to open and close the stroller....I was walking in the mall and my foot accidentally hit the bar but not very hard and it caused the stroller to fold with my grandbaby in it. I did not realize it at first, I just noticed it didn't feel right while pushing, well, it's because it was folding up. My grandbaby wasn't hurt but still, it should be more secure. It shouldn't be that easy to unfold",,,TRUE,https://www.amazon.com/gp/customer-reviews/RSXJR5E2A5ZP6/ref=cm_cr_arp_d_rvw_ttl?ie=UTF8&ASIN=B07P1YSC18,0,B07GGHVL64,Color: Blue,
06/30/2022,United States,2,jacqueline,The seating is very thin and your baby will fill the metal Bars,"I think the seating and back part can have cushion in it, it’s a cheap Stroller I guess you get what you pay for.",,,TRUE,https://www.amazon.com/gp/customer-reviews/R1W4WNUQQ3EY36/ref=cm_cr_arp_d_rvw_ttl?ie=UTF8&ASIN=B07P1YSC18,0,B07SRVB6T6,Color: Pink/Black,
06/30/2022,United States,2,Erika Olvera,No great,"I like the how lightweight it is, however the front wheels are always turning or not turning making it hard ro maneuver.",,,TRUE,https://www.amazon.com/gp/customer-reviews/R1MRAJ9L9SES1O/ref=cm_cr_arp_d_rvw_ttl?ie=UTF8&ASIN=B07P1YSC18,0,B07P1YSC18,Color: Gray,
06/30/2022,United States,5,Sam,Bang for your buck,I live in NYC and was looking for a stroller that can easily maneuver and fold small. This takes the cake. Super easy set up. So light weight. 10/10 recommend,,,TRUE,https://www.amazon.com/gp/customer-reviews/R12FB17XWZFIT/ref=cm_cr_arp_d_rvw_ttl?ie=UTF8&ASIN=B07P1YSC18,0,B07P1YSC18,Color: Gray,
06/29/2022,United States,1,Ed,Wouldn’t recommend,The front wheels don’t spin they stay straight wouldn’t recommend,,,TRUE,https://www.amazon.com/gp/customer-reviews/R1RCNQNEAIKIY7/ref=cm_cr_arp_d_rvw_ttl?ie=UTF8&ASIN=B07P1YSC18,1,B07GGHVL64,Color: Blue,
06/29/2022,United States,2,Emma,Very cheap,"Very cheaply made. Awful wheels, rough material/loud where the kid sits, metal bar for folding and almost get pinched in every time. Not even worth the $50.",,,TRUE,https://www.amazon.com/gp/customer-reviews/R2NJAAIZ470DYB/ref=cm_cr_arp_d_rvw_ttl?ie=UTF8&ASIN=B07P1YSC18,0,B07P1YSC18,Color: Gray,
