Date,Country/Location,Rating,Author,Title,Body,Image links,Image Video Links,Verified Purchase,URL,Helpful count,Variation information,Styles,
01/19/2021,United States,2,Priscilla Rivas,Cheap and broke on first outing,"I wanted to love this but very disappointed. It is super light weight, not bulky and relatively easy to fold up and carry with one hand. But it did feel very flimsy and cheap. I wasn't too bothered by that as I only needed this stroller for going into the docs office or running quick errands.However, on the very first outing with it on a side walk, there was a slightly uneven section and when I went over it, the front left wheel bent outward. Also, after only being on the concrete sidewalk for the length of a parking lot, the wheels looked all worn out (see photo.) I can't imaging this having any durability.Also, I'm 5'7 and the handle height is just right for me. If you're any taller than that, this may uncomfortable.",https://images-na.ssl-images-amazon.com/images/I/D1M9vFZ5I1S._SY1600.jpg,,TRUE,https://www.amazon.com/gp/customer-reviews/R2C7Z5XU320C1R/ref=cm_cr_arp_d_rvw_ttl?ie=UTF8&ASIN=B07P1YSC18,0,B07GGHVL64,Color: Blue,
01/18/2021,United States,5,Steven Christopher,Great product,"I have no complaints with this product. Really glad I purchased this stroller. My child also enjoys it. If your thinking about getting a small foldable stroller this one is the one to get. The price is a little higher but the cheaper strollers don't do the job for a heavier kid. My child is 5 yrs. old and about 43 pounds and he fits great in the seat the stroller had no issues with his weight pushed perfectly wasn't hard to get around at all, he still had room on the sides of him so he wasn't crammed or uncomfortable. I have a 3 wheeled stroller that doesn't fold up anymore and I was tired of buying cheap sun strollers that would break in the matter of months, this product is awesome and very sturdy and I highly recommend this for a second stroller that's easy to fold and put away. My boy perfers to use this stroller than his big one. Well put togetter and the stitching is very well done!",,,TRUE,https://www.amazon.com/gp/customer-reviews/R3KXZQWWWT8ANY/ref=cm_cr_arp_d_rvw_ttl?ie=UTF8&ASIN=B07P1YSC18,1,B07GGHVL64,Color: Blue,
01/17/2021,United States,2,Js,Hard to steer,We wanted a smaller stroller instead of lugging the jogging stroller every where since it's big and bulky. Big mistake on my part it is so hard to turn and the seat doesn't recline or straighten out on ours. The front set of wheels only 1 wheel on each side touches the ground (I'm assuming this is why it's so hard to steer. I seen all the reviews and I'm guessing ours must have been a defective one cause I wish I never bought it,,,TRUE,https://www.amazon.com/gp/customer-reviews/R27YMAEAUT4NZN/ref=cm_cr_arp_d_rvw_ttl?ie=UTF8&ASIN=B07P1YSC18,0,B07GGHVL64,Color: Blue,
01/14/2021,United States,3,Juliane,Front tires malfunction,Front tires go sideways! Awesome stroller otherwise but becomes unusable due to front tire malfunction,,,FALSE,https://www.amazon.com/gp/customer-reviews/R1A6F9W8EW97YJ/ref=cm_cr_arp_d_rvw_ttl?ie=UTF8&ASIN=B07P1YSC18,0,B07GGHVL64,Color: Blue,
01/13/2021,United States,5,Solimar,"Sturdy, lightweight, easy to maneuver!","I bought this stroller for my 9yr old daughter to use with her dolls, she is really tall so a regular doll strollers would make her hunch to push it. Also doll strollers have become very pricey. My daughter has Cerebral Palsy so she needs something that is sturdy, lightweight, and easy to maneuver, this stroller is perfect and it folds up easy when play time is over.",,,TRUE,https://www.amazon.com/gp/customer-reviews/R1AQ1FM7B2M3KW/ref=cm_cr_arp_d_rvw_ttl?ie=UTF8&ASIN=B07P1YSC18,2,B07GGHVL64,Color: Blue,
01/12/2021,United States,4,Kristen Moffitt,Compacted,"Easy to fold, carry on the go, compact",,,TRUE,https://www.amazon.com/gp/customer-reviews/RPXMVHGBNKDFF/ref=cm_cr_arp_d_rvw_ttl?ie=UTF8&ASIN=B07P1YSC18,0,B07P1YSC18,Color: Gray,
01/11/2021,United States,1,Latisha,Get What You Pay For,"Stroller is light and color is great. However, the front wheels started messing up/not spinning after 2 uses. The cupholders don't hold anything larger than a bottle. I'm 5'8 and the handles are super low for me and I have to hunch over to push the stroller.",,,TRUE,https://www.amazon.com/gp/customer-reviews/RBYEW3FJVGYOK/ref=cm_cr_arp_d_rvw_ttl?ie=UTF8&ASIN=B07P1YSC18,3,B07GGHVL64,Color: Blue,
01/11/2021,United States,4,Reinier,Wheels,my biggest concern are the wheels,,,TRUE,https://www.amazon.com/gp/customer-reviews/R92ONBXKXNK2Y/ref=cm_cr_arp_d_rvw_ttl?ie=UTF8&ASIN=B07P1YSC18,1,B07P1YSC18,Color: Gray,
01/11/2021,United States,5,Daniel,Perfect backup stroller,"It's a great backup or travel stroller. Doesn't really have any fancy features but it makes up for it by being super light and folds up really small. Not our daily stroller for walks or anything, but when you just need to grab a stroller and walk out the door, we always reach for this one.",,,TRUE,https://www.amazon.com/gp/customer-reviews/RRIDH66LA6W3W/ref=cm_cr_arp_d_rvw_ttl?ie=UTF8&ASIN=B07P1YSC18,0,B07SRVB6T6,Color: Pink/Black,
01/07/2021,United States,5,Tawnie Wagner,Great buy,Great buy,,,TRUE,https://www.amazon.com/gp/customer-reviews/R1HJNR1EMQ03OV/ref=cm_cr_arp_d_rvw_ttl?ie=UTF8&ASIN=B07P1YSC18,0,B07GGHVL64,Color: Blue,
01/07/2021,United States,4,Jenn,Not for everyday use,"This product arrived in great condition, easy to put together, easy to fold and light weight.THIS STROLLER IS NOT MEANT FOR EVERYDAY USE.If you need a durable stroller for everyday use (i.e. you are the full time parent) this is not it. Just like any other cheap light weight stroller it is best for limited easy use. I am not a full time parent, I am an aunt who only occasionally has the kids and is it or miss on needing a stroller. For that reason this stroller works well enough.",,,TRUE,https://www.amazon.com/gp/customer-reviews/R2G0W6MU70MFO6/ref=cm_cr_arp_d_rvw_ttl?ie=UTF8&ASIN=B07P1YSC18,1,B07P1YSC18,Color: Gray,
01/06/2021,United States,1,Bonnie,Arrived wrong,This item came messed up. The right front wheel does not touch the ground.,,,TRUE,https://www.amazon.com/gp/customer-reviews/R2MX9BI62LUBET/ref=cm_cr_arp_d_rvw_ttl?ie=UTF8&ASIN=B07P1YSC18,0,B07GGHVL64,Color: Blue,
01/06/2021,United States,4,Joseph,Quality stroller with LOW quality tires.,"Overall, good purchase! The stroller is high quality but the tires are very low quality and plastic. I’m debating returning it for something higher quality but it should do just fine for our trip.I did read all reviews before purchasing and decided to give it a try.My son is 6mo (29inch long/25lb big boy) and he already fell asleep in it pushing around our house. I clipped the umbrella shade lower on the handle but it can be higher. If the tires weren’t hallow plastic I think this would be a 10/10. They seem secure, just low quality.",https://images-na.ssl-images-amazon.com/images/I/B1A8HfLsBkS._SY1600.jpg,,TRUE,https://www.amazon.com/gp/customer-reviews/R1YMKJLZUJEPPQ/ref=cm_cr_arp_d_rvw_ttl?ie=UTF8&ASIN=B07P1YSC18,0,B07P1YSC18,Color: Gray,
01/05/2021,United States,5,Kimberly Borelli,Perfect everyday stroller,"I keep this in my car 24/7. It is perfect!! Easy to steer, light weight, comfortable, we love it!",,,TRUE,https://www.amazon.com/gp/customer-reviews/R5GNSF9BRGMZI/ref=cm_cr_arp_d_rvw_ttl?ie=UTF8&ASIN=B07P1YSC18,0,B07GGHVL64,Color: Blue,
01/05/2021,United States,4,Sandy Erazo,Perfect light weight,Perfect for short errands.,,,TRUE,https://www.amazon.com/gp/customer-reviews/R330QDZDRGZ1D5/ref=cm_cr_arp_d_rvw_ttl?ie=UTF8&ASIN=B07P1YSC18,0,B07P1YSC18,Color: Gray,
01/04/2021,United States,1,Gildalis F.,El artículo no llego bien,Llego roto la goma,"https://images-na.ssl-images-amazon.com/images/I/B1fWCYIpUbS._SY1600.jpg, https://images-na.ssl-images-amazon.com/images/I/B1nGM0t3JbS._SY1600.jpg",,TRUE,https://www.amazon.com/gp/customer-reviews/R19UXMML0KEEEK/ref=cm_cr_arp_d_rvw_ttl?ie=UTF8&ASIN=B07P1YSC18,0,B07P1YSC18,Color: Gray,
01/01/2021,United States,3,Emily Johnson,Good but so hard to collapse.,No matter what I do I have to use the force of 7 elephants to collapse this stroller. It’s great but this is really making me considering returning it.,,,TRUE,https://www.amazon.com/gp/customer-reviews/R17AL1VJF0VBO5/ref=cm_cr_arp_d_rvw_ttl?ie=UTF8&ASIN=B07P1YSC18,0,B07P1YSC18,Color: Gray,
12/31/2020,United States,2,J.,Nuts fall off easilyv,We had a nut fall off one of the bolts randomly while walking and didn't notice pretty inconvenient,,,TRUE,https://www.amazon.com/gp/customer-reviews/REE1N3F8OO2RN/ref=cm_cr_arp_d_rvw_ttl?ie=UTF8&ASIN=B07P1YSC18,0,B07GGHVL64,Color: Blue,
12/31/2020,United States,1,allie,Wheels don’t all work,"The front wheels only the inside wheel would go around the out side wheels wouldn’t move unless you put pressure on one side the entire time , but then the other side neither wheel would go",,,TRUE,https://www.amazon.com/gp/customer-reviews/R45RRQIRN5RAF/ref=cm_cr_arp_d_rvw_ttl?ie=UTF8&ASIN=B07P1YSC18,1,B07P1YSC18,Color: Gray,
12/30/2020,United States,4,CBrodeur,Overall Very Good,"Very lightweight and easy to move, fold up/open. My only complaints are that I wish it reclined back more and the sun shade doesn’t offer a whole lot of coverage once the sun is low in the sky (late afternoon) but I do love this stroller otherwise!",,,TRUE,https://www.amazon.com/gp/customer-reviews/R4X77MLAS15KG/ref=cm_cr_arp_d_rvw_ttl?ie=UTF8&ASIN=B07P1YSC18,0,B07P1YSC18,Color: Gray,
12/29/2020,United States,1,Fatima Rizvi,Returned it,"Very cheaply made. Its just like a 25$ umbrella stroller. Its not worth it to spend 44$ on it. It just have a storage basket at the bottom. Thats the only thing i liked in it. I ordered the grey one for my girl and they delivered the blue. Also the back of the seat is super light and can touch the steel frame when the child sits in it. It reclines very less. Overall, i would only keep this stroller if it was cheaper just like regular umbrella strollers since it is made like one.",,,TRUE,https://www.amazon.com/gp/customer-reviews/R27AAT5KSK7H6H/ref=cm_cr_arp_d_rvw_ttl?ie=UTF8&ASIN=B07P1YSC18,0,B07P1YSC18,Color: Gray,
12/28/2020,United States,5,CFT,Very practical and well made little stroller,I bought this for my granddaughter so I could take walks with her when she stayed with me. It is light weight and maneuverable. I like that it is quite adjustable as well.,,,TRUE,https://www.amazon.com/gp/customer-reviews/R3OHPKSCLSPXXO/ref=cm_cr_arp_d_rvw_ttl?ie=UTF8&ASIN=B07P1YSC18,0,B07GGHVL64,Color: Blue,
12/26/2020,United States,1,Amibear2,STAY AWAY,"Worst stroller ever.. The first one we bought was broken.. We got a replacement and at least the time the wheels spun however, this stroller DOES NOT TURN.. I have to tip my stroller and child on the back wheels to even turn.. What a joke",,,TRUE,https://www.amazon.com/gp/customer-reviews/R1KFKAHI9X897H/ref=cm_cr_arp_d_rvw_ttl?ie=UTF8&ASIN=B07P1YSC18,0,B07P1YSC18,Color: Gray,
12/26/2020,United States,1,Justin C. Rosini,Garbage,Wheel fell off with my daughter in it. Then it’s $30 for a box to return the thing. Never again,,,TRUE,https://www.amazon.com/gp/customer-reviews/RZJZS1RAWAGIQ/ref=cm_cr_arp_d_rvw_ttl?ie=UTF8&ASIN=B07P1YSC18,0,B07P1YSC18,Color: Gray,
12/25/2020,United States,5,Michael s Butler,baby stroller,would purchase again,,,TRUE,https://www.amazon.com/gp/customer-reviews/R1XCCL9VM8ZUVM/ref=cm_cr_arp_d_rvw_ttl?ie=UTF8&ASIN=B07P1YSC18,0,B07GGHVL64,Color: Blue,
12/22/2020,United States,5,Deanna B.,perfect and easy to use,we love it,,,TRUE,https://www.amazon.com/gp/customer-reviews/RPOPRECFED7QL/ref=cm_cr_arp_d_rvw_ttl?ie=UTF8&ASIN=B07P1YSC18,0,B07P1YSC18,Color: Gray,
12/22/2020,United States,4,A Driver,Happy enough.,"Pretty great. Reasonable price.My only complaint is the TINY basket underneath. It is too small to be of much use anyway, but when your baby is in the seat, you can't get anything in or out of there. I bought the stroller for navigating the airport. It's perfect for that.",,,TRUE,https://www.amazon.com/gp/customer-reviews/R2AVZ2Z1Q4CV7N/ref=cm_cr_arp_d_rvw_ttl?ie=UTF8&ASIN=B07P1YSC18,0,B07GGHVL64,Color: Blue,
12/22/2020,United States,1,S.R.Thompson,Garbage,"I have nothing positive to say about this stroller. It's too long to fit in the rear of my midsize car. The lock mechanism is stiff. The canopy is not remotely functional. It's difficult to steer, and the backrest is flimsy and unsupportive.",,,FALSE,https://www.amazon.com/gp/customer-reviews/R3TSOWOVSA9WSZ/ref=cm_cr_arp_d_rvw_ttl?ie=UTF8&ASIN=B07P1YSC18,0,B07P1YSC18,Color: Gray,
12/20/2020,United States,2,Stacy A. Hummel,I hate this stroller!,"Bought this stroller to downsize and replace our big hand me down stroller. We don't really use it much either but I hate it!It's unbalanced, one front wheel is a cm off the ground so it doesn't turn. Now after using it a few times the front wheels don't turn anymore you just have to slide it.Canopy also never stays in place.I will be buying a different one and chucking this.",,,TRUE,https://www.amazon.com/gp/customer-reviews/RVY5YJGB1XHGX/ref=cm_cr_arp_d_rvw_ttl?ie=UTF8&ASIN=B07P1YSC18,0,B07GGHVL64,Color: Blue,
12/18/2020,United States,5,T.W. Nelson,Grandkids love it.,Easy to assemble! Love the light weight. Fits in a small storage area.,,,TRUE,https://www.amazon.com/gp/customer-reviews/R3GKKUR6ACSGEO/ref=cm_cr_arp_d_rvw_ttl?ie=UTF8&ASIN=B07P1YSC18,0,B07P1YSC18,Color: Gray,
12/17/2020,United States,5,Debbie,Perfect stroller,Love it,,,TRUE,https://www.amazon.com/gp/customer-reviews/RZHRAYLHEOK7E/ref=cm_cr_arp_d_rvw_ttl?ie=UTF8&ASIN=B07P1YSC18,0,B07GGHVL64,Color: Blue,
12/16/2020,United States,5,Rai,Great price,Love everything about this stroller. So much quality for a great price.,,,TRUE,https://www.amazon.com/gp/customer-reviews/R3H9SAZWX5HS4R/ref=cm_cr_arp_d_rvw_ttl?ie=UTF8&ASIN=B07P1YSC18,0,B07GGHVL64,Color: Blue,
12/14/2020,United States,4,Susan D Posey,"Very nice, good quality","I love the stroller, but I have trouble folding it. Maybe it's just me, my husband folds it w/ little problems. I think it will loosen up a bit more in time. Other wise, great stroller. Very light weight which I needed.",,,TRUE,https://www.amazon.com/gp/customer-reviews/R11THVGUY549OM/ref=cm_cr_arp_d_rvw_ttl?ie=UTF8&ASIN=B07P1YSC18,1,B07GGHVL64,Color: Blue,
12/12/2020,United States,1,Andrei Belikov,3 months warranty.,Summer Infant provides only 3 months warranty. One of the wheels fell away after 8 months of not frequently using.,,,TRUE,https://www.amazon.com/gp/customer-reviews/RA6165HQWELI3/ref=cm_cr_arp_d_rvw_ttl?ie=UTF8&ASIN=B07P1YSC18,0,B07P1YSC18,Color: Gray,
12/09/2020,United States,1,JJF,TERRIBLE,"Perhaps it was the package was beyond destroyed, too bad I did not take pictures.Perhaps it is the safety hazard of loosing a finger when trying to close the unit.Perhaps it was the legs and arms being bent.Perhaps it was the moist and foul smell of the foam handles.Perhaps amazon needs to get with it and not overlook quality control on items.and finally perhaps they need to update their system, I returned the unit with their label and have yet to receive credit for it.I am not alone on this but Amazon looses quality with each passing day, sad. I own stock :(",,,TRUE,https://www.amazon.com/gp/customer-reviews/R1L7JJNEUP8QSE/ref=cm_cr_arp_d_rvw_ttl?ie=UTF8&ASIN=B07P1YSC18,13,B07P1YSC18,Color: Gray,
12/08/2020,United States,5,Brandelyn Cordova,Absolutely Love It!!!!!!!,I purchased this stroller for a trip from Texas to California by plane. I used it for my 20 month old. It out did itself! I was pleased with the compact design and it's maneuverability. I could push it one handed and could fold it with one foot. It also unfolded easily. I loved that it was self locking when I folded it down. This stroller was a life saver. It got us through the airport with ease and had no problems getting it through the security xray machines at TSA. I also loved the 2 cup holders and zippered pocket. The basket has minimal access so it can only be used for small items but that wasn't a problem cause my diaper bag has stroller straps. Which it stayed on without tipping the stroller when my child wasn't in it. I absolutely love this stroller and plan on using it for any outting involving my little one. Highly recommend!,,,TRUE,https://www.amazon.com/gp/customer-reviews/R1KFVZ8R43P6C5/ref=cm_cr_arp_d_rvw_ttl?ie=UTF8&ASIN=B07P1YSC18,1,B07SRVB6T6,Color: Pink/Black,
12/06/2020,United States,1,ChilliConda09,Damaged POS,"So, nothing against the stroller itself. The problem is that, this product has damaged wheels, not all wheels touch the ground, hard to steer. Due to this, this stroller is a POS! SO IF YOU'RE THE SELLER READING THIS PLEASE CONTACT ME SO THAT WE CAN RESOLVE THIS ISSUE! Thank you.","https://images-na.ssl-images-amazon.com/images/I/81KXPn768TL._SY1600.jpg, https://images-na.ssl-images-amazon.com/images/I/81bwBlj1mAL._SY1600.jpg, https://images-na.ssl-images-amazon.com/images/I/914a8w2h7bL._SY1600.jpg",,TRUE,https://www.amazon.com/gp/customer-reviews/R1S4A0YCX0I6F5/ref=cm_cr_arp_d_rvw_ttl?ie=UTF8&ASIN=B07P1YSC18,2,B07P1YSC18,Color: Gray,
12/06/2020,United States,5,CFND,Tire worn out so quick,One tire on the front left side doesn’t touch the floor,,,TRUE,https://www.amazon.com/gp/customer-reviews/R2HJYUAGWECX4U/ref=cm_cr_arp_d_rvw_ttl?ie=UTF8&ASIN=B07P1YSC18,0,B07GGHVL64,Color: Blue,
12/05/2020,United States,4,Allison,Nice quality without breaking the bank,I think the folding mechanism is a little challenging and the maneuverability is a little challenging since the front wheels don’t turn. But this is a nice quality lightweight stroller that doesn’t break the bank and fits neatly in my trunk.,,,TRUE,https://www.amazon.com/gp/customer-reviews/R1Y2E64D7WUHVZ/ref=cm_cr_arp_d_rvw_ttl?ie=UTF8&ASIN=B07P1YSC18,0,B07GGHVL64,Color: Blue,
12/05/2020,United States,5,Danielle K.,A great investment!,"I love this stroller. I went from a bulky jogger to this and it is such a lifesaver. Lightweight and easy to fold, I use it every time I need to wrangle in my toddler while out in public. She rides comfortably and can't escape as easily with the harness buckling (much better than just a lap belt.)",,,TRUE,https://www.amazon.com/gp/customer-reviews/RTSMSPG929H87/ref=cm_cr_arp_d_rvw_ttl?ie=UTF8&ASIN=B07P1YSC18,0,B07GGHVL64,Color: Blue,
12/04/2020,United States,2,Amy Ting,Wheel does not spin,"The media could not be loaded.
  
  
  
  
  
  
  
  
 

 

 

 

 

 

 

 

  
  
   The product I received has definitely been used and returned before. The wheels were scuffed and there was a very noticeable deep scratch in the hard plastic part of one of the wheels. That same wheel also will not screw in flat, as shown by the video. Pretty disappointed in the quality.",https://images-na.ssl-images-amazon.com/images/I/81A4I79uOLL._SY1600.jpg,,TRUE,https://www.amazon.com/gp/customer-reviews/R3KMVMCLSP828D/ref=cm_cr_arp_d_rvw_ttl?ie=UTF8&ASIN=B07P1YSC18,7,B07P1YSC18,Color: Gray,
12/04/2020,United States,5,Jaycie Cantrell,Perfect fit for my 6 month old,So light weight and easy to fold!,,,TRUE,https://www.amazon.com/gp/customer-reviews/R1TJFFSJ132VD0/ref=cm_cr_arp_d_rvw_ttl?ie=UTF8&ASIN=B07P1YSC18,0,B07GGHVL64,Color: Blue,
12/01/2020,United States,1,Sara P,Wouldn’t recommend it for the price,"Stroller is easy to fold and very light weight, but one of the front wheels does not touch the floor making it hard to maneuver also getting randomly stuck when pushing the stroller.",,,TRUE,https://www.amazon.com/gp/customer-reviews/R166DRG7O0YW4A/ref=cm_cr_arp_d_rvw_ttl?ie=UTF8&ASIN=B07P1YSC18,0,B07GGHVL64,Color: Blue,
11/30/2020,United States,2,TaShawna Crump,🤦🏾‍♀️,The wheels go all over the place,,,TRUE,https://www.amazon.com/gp/customer-reviews/R1HX1B5LGFSDOI/ref=cm_cr_arp_d_rvw_ttl?ie=UTF8&ASIN=B07P1YSC18,0,B07GGHVL64,Color: Blue,
11/29/2020,United States,5,Lucia A Perez,Very convenient and recomendable!,"This stroller is pefect for my 3 1/2 month old baby sister! It is super compact, easy to assemble, and it is also made of very good material!","https://images-na.ssl-images-amazon.com/images/I/81gRsmLX9GL._SY1600.jpg, https://images-na.ssl-images-amazon.com/images/I/81iQAdgm8SL._SY1600.jpg",,TRUE,https://www.amazon.com/gp/customer-reviews/R33C00N6GYR1O6/ref=cm_cr_arp_d_rvw_ttl?ie=UTF8&ASIN=B07P1YSC18,3,B07SRVB6T6,Color: Pink/Black,
11/27/2020,United States,5,Ileana M.,Light Weight and Sturdy,"Love it, read some of the reviews first and all is true, light weight, and sturdy.",,,TRUE,https://www.amazon.com/gp/customer-reviews/R2AXZG0526MWZQ/ref=cm_cr_arp_d_rvw_ttl?ie=UTF8&ASIN=B07P1YSC18,0,B07P1YSC18,Color: Gray,
11/25/2020,United States,4,wendy,pretty good,"My original umbrella stroller died after use with 5 children.. go figure. so i bought another umbrella stroller and wasn't impressed with the quality-so i tried this one. for $20 extra, you get a seat that kinda reclines, a storage basket you can sorta access, a canopy, and a drink/stuff holder for the adult. it's a great concept and i think it's a step up from the umbrella strollers available today. but baby's back isn't comfortable as the old stroller, it's got a weird triple pie shape that expands but isn't smooth so baby boy is never able to fall asleep. it doesn't recline enough back to lay his head back to sleep, and the handle is still too close to the ground for my height and i'm 5'4 -so my 6'2 husband has a tough time using it at all- but that's with almost every stroller.",,,TRUE,https://www.amazon.com/gp/customer-reviews/R1R658W7W2GUU6/ref=cm_cr_arp_d_rvw_ttl?ie=UTF8&ASIN=B07P1YSC18,0,B07P1YSC18,Color: Gray,
11/21/2020,United States,4,Luke Georgia,Good for indoor jaunts,Definitely a good mall or airport stroller. A back wheel started wobbling pretty quickly after a neighborhood pavement stroll when we were too lazy to get the good stroller out of the garage.,,,TRUE,https://www.amazon.com/gp/customer-reviews/R9CFHP7L3MPE/ref=cm_cr_arp_d_rvw_ttl?ie=UTF8&ASIN=B07P1YSC18,0,B07GGHVL64,Color: Blue,
11/18/2020,United States,5,Christine Sylvester,Can be a little hard to fold,I wanted an inexpensive stroller to have for the times that I babysit my grandson. This was exactly what I was looking for.,,,TRUE,https://www.amazon.com/gp/customer-reviews/RW08MBIB6NA9M/ref=cm_cr_arp_d_rvw_ttl?ie=UTF8&ASIN=B07P1YSC18,0,B07GGHVL64,Color: Blue,
11/14/2020,United States,5,Amazon Customer,great,great for disney trip,,,TRUE,https://www.amazon.com/gp/customer-reviews/R1E85J4L0SPM8H/ref=cm_cr_arp_d_rvw_ttl?ie=UTF8&ASIN=B07P1YSC18,0,B07GGHVL64,Color: Blue,
11/14/2020,United States,1,celia schiffner,broke after 2nd use,"I bought this for when my grandson came to visit. It was easy enough to put together and push him around. However, after the 2nd time using it, I could no longer fold it. What good is having a stroller that you can't fold and put in the car. Very disappointed in this purchase. Look elsewhere for a dependable lightweight stroller. Do not but this one",,,TRUE,https://www.amazon.com/gp/customer-reviews/R3AO9G0JYZLHA3/ref=cm_cr_arp_d_rvw_ttl?ie=UTF8&ASIN=B07P1YSC18,1,B07GGHVL64,Color: Blue,
11/14/2020,United States,1,Would I buy this again??,Inexpensive latch assembly,"Nice and convenient. But after the fourth time of trying to bucket in my grandson, the latch on the seat portion broke off not allowing for a secure connection of the seat belt. I returned the stroller for a refund but have not yet received any refund for the product.",,,TRUE,https://www.amazon.com/gp/customer-reviews/R1D7ILSS5BOZUR/ref=cm_cr_arp_d_rvw_ttl?ie=UTF8&ASIN=B07P1YSC18,0,B07GGHVL64,Color: Blue,
11/14/2020,United States,1,Heather,Poorly made,One of the front wheels doesn't touch the ground even with my child in it to weight it down.,,,TRUE,https://www.amazon.com/gp/customer-reviews/RY55IFPSAYRT3/ref=cm_cr_arp_d_rvw_ttl?ie=UTF8&ASIN=B07P1YSC18,0,B07SRVB6T6,Color: Pink/Black,
11/12/2020,United States,5,LyVea Oliver,Perfect Downgrade Size Wise!,"So I now have a toddler, and wanted to transition from her travel system stroller. This met the 3 things I wanted: easy to fold, lightweight, and cute.2 built in cup holders. Small, but decent size storage underneath. Super easy to fold up! Took very little time finishing the assembly. Only small issue is the canopy pops off sometimes when I fold it up. Not a huge deal though. And I love the handles, makes for easier steering! I had this style handle with her travel system so I wanted it again.",https://images-na.ssl-images-amazon.com/images/I/717wkyGlWxL._SY1600.jpg,,TRUE,https://www.amazon.com/gp/customer-reviews/R1W2KA7EFSK3UC/ref=cm_cr_arp_d_rvw_ttl?ie=UTF8&ASIN=B07P1YSC18,2,B07SRVB6T6,Color: Pink/Black,
11/11/2020,United States,3,CZ,"Not bad, not great. Wheels skid, not easy to maneuver.","Used this for the airport and travel. It was adequate. The back wheels both wobble and the front wheels sometimes skid instead of roll which makes it more resistant to rolling. Difficult to maneuver or even keep straight one handed. Not bad for the price ($40), but not great either. It got the job done.",,,TRUE,https://www.amazon.com/gp/customer-reviews/RPBNNUUVG0JNF/ref=cm_cr_arp_d_rvw_ttl?ie=UTF8&ASIN=B07P1YSC18,0,B07GGHVL64,Color: Blue,
11/08/2020,United States,5,eileen dietz,Great Stroller,Great little stroller. So easy to open and close. Fits under the backseat of my truck. Worth every penny.,,,TRUE,https://www.amazon.com/gp/customer-reviews/R276E214VMBSGF/ref=cm_cr_arp_d_rvw_ttl?ie=UTF8&ASIN=B07P1YSC18,0,B07GGHVL64,Color: Blue,
